uid,body,title,url,newspaper_uid,host,n_tokens_title,n_tokens_body
033ff0d48b88011c232a99858e6eb217,"Un hombre pasea por la bahía de Hong Kong, un día después de que el Gobierno chino diera a conocer la ley de Seguridad Nacional que prevé para la ciudadISAAC LAWRENCE / AFPHong Kong contiene el aliento antes de que la semana próxima el Legislativo chino, pasando por encima del parlamento autónomo, le imponga una polémica ley de Seguridad Nacional que impedirá cualquier actividad “separatista” o “terrorista"", la “subversión de los poderes del Estado” y la “injerencia de poderes extranjeros”. Para muchos en este territorio temen que esas normas puedan herir de muerte al principio “un país, dos sistemas”, que garantiza a este centro financiero internacional libertades inexistentes en la China continental y que debe regir hasta 2047.A lo largo del día se han desarrollado pequeños actos de protesta en algunos centros comerciales de Hong Kong, donde varias docenas de personas se han concentrado para corear eslóganes y cantar “Gloria a Hong Kong”, el himno de las protestas contra Pekín y el Gobierno autónomo que paralizaron la ciudad el año pasado. Para este domingo se prepara una movilización de mayor tamaño: un comunicado conjunto de varios grupos de manifestantes invitaba a tomar parte en una protesta tanto a participantes pacíficos como a “valientes”, los radicales que en las protestas del año pasado se enfrentaban con la Policía. En una rueda de prensa difundida a través de Facebook, un grupo de activistas bajo el nombre Citizens’ Press Conference aseguraba que “bajo este decreto, Hong Kong será un trozo de tierra quemada”.Señal en directo de las protestas de Hong Kong. reutersEn un comunicado, 380 concejales de distrito -el nivel más bajo de Gobierno en Hong Kong, pero donde la oposición pandemócrata domina 17 de los 18 distritos, tras un triunfo contundente en las elecciones municipales de noviembre pasado- se declararon dispuestos a resistir las nuevas medidas, que consideran que “llevarán a Hong Kong al abismo”.El proyecto de ley se examinará este lunes y martes en el seno de la Asamblea Nacional Popular (ANP) y el jueves los 3.000 delegados de este órgano la someterán a votación, sin que haya ninguna duda de que será aprobada. La medida quedará inscrita en un anexo de la Ley Básica, la miniconstitución hongkonesa.Uno de los aspectos que más preocupación ha suscitado entre los políticos del campo pandemócrata, los manifestantes y sus simpatizantes, es que la ley abre una vía a que los servicios de inteligencia chinos puedan comenzar a operar oficialmente en Hong Kong. Según los críticos, ese paso puede dar lugar a detenciones arbitrarias, que los arrestados queden bajo custodia de las autoridades por tiempo indefinido e, incluso, tortura. La nueva ley ""hace que el principio un país, dos sistemas se quede en mera palabrería y que las libertades de Hong Kong desaparezcan”, aseguran los concejales pandemócratas.Con esta medida, China -que vio con furia cómo las manifestaciones del año pasado se transformaban de marchas pacíficas para reclamar la retirada de un proyecto de ley de extradición en protestas a menudo violentas contra su control y el Gobierno autónomo- busca impedir cualquier actividad que considere “separatista”, “terrorista”, “subversión contra los poderes del Estado” o “injerencia extranjera”. Cuatro categorías que aplicó reiteradamente a las protestas de 2019.En declaraciones en el Consejo Popular Consultivo, un órgano que asesora al Legislativo y también celebra sus reuniones esta semana en el Gran Palacio del Pueblo, el viceprimer ministro Han Zheng, responsable de los asuntos de Hong Kong dentro del Gobierno chino, ha declarado que la medida solo estará dirigida contra “un pequeño grupo de gente que perjudica la seguridad nacional”. Según Han, citado por el periódico South China Morning Post, la futura ley saneará el ambiente para hacer negocios y ayudará a proteger la propiedad y la integridad física de los ciudadanos.El Gobierno autónomo que encabeza Carrie Lam ha prometido apoyar a Pekín en la defensa de la seguridad nacional. El antiguo jefe del ejecutivo local Leung Chung-ying ha defendido la nueva ley y la posibilidad de que se cree un cuerpo especial de policía secreta, en declaraciones a Reuters. “Singapur tiene una policía secreta. Nosotros no. Estados Unidos tiene todo tipo de cuerpos que tienen como misión defender la seguridad nacional frente a posibles amenazas. Nosotros no. Así que no es sorprendente que, como parte de los esfuerzos para llenar el vacío legal en torno a la seguridad nacional, tengamos que establecer ese tipo de organismo”, ha sostenido.La posición del Reino UnidoEl que fuera el último gobernador de Hong Kong durante su tiempo como colonia británica, Chris Patten, ha acusado al Gobierno chino de traicionar a la población de ese territorio y ha afirmado que el Reino Unido tiene la obligación moral, legal y económica de defenderla. “Occidente debe dejar de postrarse ante Pekín a cambio de un ilusorio montón de oro”, ha dicho al diario The Times el político que vio arriar por última vez la bandera del Reino Unido en la colonia en 1997, cuando Londres devolvió a China el territorio después de más de 150 años de mandato, informa Rafa de Miguel.Hasta el momento, el Gobierno británico ha decidido expresar su protesta contra el endurecimiento de las leyes chinas en Hong Kong, que pretenden frenar el movimiento democrático de sus habitantes, de modo conjunto con otras naciones de la Commonwealth (Comunidad de Naciones). En un texto anunciado a la vez por los ministros de Exteriores de Australia y Canadá este viernes, se expresa la “profunda preocupación” de estos países por el movimiento del Gobierno chino: “Aprobar esas leyes en nombre de Hong Kong sin la participación directa de sus ciudadanos ni de sus poderes legislativo o judicial va directamente en contra del principio “un país, dos sistemas” bajo el que se garantizó a Hong Kong un alto grado de autonomía”.",Hong Kong contiene el aliento frente a la polémica ley de seguridad nacional de China,/internacional/2020-05-23/hong-kong-contiene-el-aliento-frente-a-la-polemica-ley-de-seguridad-nacional-de-china.html,elpais,,10,506
4e952eb74cf613f8497f6d3d177f8f31,"Entre 1900 y 1907, Mary Mallon, una cocinera irlandesa que trabajaba en Nueva York, contagió el tifus a decenas de personas. Ella no tenía síntomas y se negó a cooperar cuando George Soper, un ingeniero especializado en saneamiento, la identificó como el origen de una serie de misteriosas infecciones en los barrios ricos de la ciudad. No entendía por qué querían impedirle trabajar si ella se encontraba bien. Para secar la fuente del contagio, confinaron a la mujer en el hospital Riverside hasta 1910. Ese año fue liberada con la promesa de que no volviera a trabajar de cocinera. En 1915, 25 personas enfermaron de tifus en el Sloan Maternity Hospital de Manhattan. Una investigación descubrió que una de las cocineras de la institución, Mary Brown, era en realidad Mary Mallon. Mary, apodada como la tifoidea por los medios de la época, fue devuelta a Riverside, donde permaneció hasta su muerte en 1938.El caso de la pobre Mary es uno de los primeros y más célebres de supercontagiadores, individuos que transmiten a muchas personas enfermedades que otros infectados apenas contagian. El fenómeno se ha descrito en muchas epidemias como las de ébola, VIH o SARS. Esta última enfermedad, provocada por un pariente del coronavirus causante de la actual pandemia, fue indentificada en 2002. Un análisis del brote de la enfermedad en Singapur descubrió que, de 201 contagiados, el 81% no parecía haber contagiado a nadie. Sin embargo, cinco individuos infectaron a 10 o más de sus contactos. En total, empleando datos del progreso de la epidemia en Hong Kong y Singapur, investigadores de la Universidad de Hong Kong calcularon que alrededor del 70% de las infecciones se debían a fenómenos de supercontagio. Entonces, muchos de estos brotes se explicaban porque la persona no había sido ingresada hasta cuatro días o más después del inicio de los síntomas. Aquel hallazgo probó la importancia de identificar los casos a tiempo y aislarlos.Algunos estudios calculan que el 80% de los casos en la actual pandemia proceden de un 10% de los infectadosCon el SARS-CoV-2, el virus responsable de la crisis actual, se estima que, si no se aplican medidas de distanciamiento social o higiene, cada contagiado pasaría el patógeno a tres personas. Pero esa es la media. En realidad, como sucedió con el primer SARS, lo normal es que la mayoría contagien poco o nada y haya algunos que contagien a muchos. Un trabajo reciente de un equipo de la Escuela de Higiene y Medicina Tropical de Londres estimaba que el 80% de los nuevos casos en la actual pandemia procedían de un 10% de los infectados. En España, según un estudio realizado por investigadores de la Universidad de Santiago de Compostela (USC) y el Hospital Universitario de la ciudad gallega (SERGAS), estos supercontagiadores podrían estar detrás de la mitad de todos los casos.A partir de una muestra de 5000 genomas del virus, el equipo, liderado por Antonio Salas y Federico Martinón-Torres, observó las mutaciones para reconstruir el comportamiento del patógeno desde su origen. “Entre las cosas positivas, hemos visto que ha habido poca variación, que es estable, y eso es mejor para que las vacunas que se están desarrollando funcionen”, explica Martinón-Torres, investigador de la USC y el SERGAS. Otro de los hallazgos del análisis es la existencia de cuellos de botella en la diversidad del virus, que a partir de ese punto se transmite a un gran número de personas. De ahí deducen los autores la presencia de supercontagiadores, en este caso, unas docenas de individuos, que contagian a 20 o 30 de sus contactos y explican la mitad de esos 5.000 contagios.La experiencia con el SARS sugiere que la conclusión es plausible, pero Fernando González Candelas, investigador de la Fundació per al Foment de la Investigació Sanitària i Biomèdica de la Comunitat Valenciana (Fisabio) y responsable de un proyecto para reunir hasta 20.000 secuencias del genoma del virus en España, advierte que el efecto observado podría deberse a fenómenos distintos. “Si, por ejemplo, en un lugar de trabajo, llega una persona y contagia a otra, que a su vez contagia a otra y así hasta 30, lo que observaríamos en el estudio de los genomas sería lo mismo que si una sola persona llega a ese lugar de trabajo y contagia a 30”, explica. “Se necesita un análisis epidemiológico detallado para saber quién ha infectado a quién”, añade.Antonio Salas coincide en que ahora el interés se encontraría en identificar a esos posibles supercontagiadores y analizar sus características, tanto biológicas como de comportamiento social. “Sería muy interesante tener una muestra grande de supercontagiadores, de cientos o miles, para comprender qué sucede con ellos”, indica Salas. Por ahora, no hay estudios amplios que puedan identificar cómo son esos individuos o en qué circunstancias se manifiestan. Podría tratarse, por ejemplo, de personas que por características de su sistema inmune tuviesen una carga viral elevada, pero no mostrasen síntomas y difundiesen los patógenos durante mucho tiempo sin experimentar malestar alguno. También puede suceder que la combinación con otras enfermedades incremente la capacidad de transmisión del SARS-CoV-2. Esto mismo se ha detectado en personas que además de VIH tenían herpes, algo que elevaba los niveles de material genético del virus detectados en el semen.En La Rioja, una persona con 30 contactos directos solo dio lugar a cuatro contagios por coronavirusGonzález Candelas considera muy relevante identificar a estos supercontagiadores y conocer sus particularidades, aunque cree que por el momento “es más fácil identificar las características de los entornos de riesgo que las de los individuos”. “Ahora, tenemos la mayor parte de infecciones en residencia de mayores, en centros sanitarios y algo aún en las familias. Habría que hacer más pruebas en según qué entornos y no en otros”, apunta. “Así, podríamos también fortalecer las medidas de distanciamiento social o uso de mascarilla en lugares cerrados o aliviarlas, siempre que encontrásemos pruebas que lo justificasen, en el exterior”, plantea.Mientras los investigadores acumulan evidencias sobre el comportamiento del virus y su forma de transmisión, los gestores tienen que trabajar con los datos limitados de que disponen. En La Rioja se dio uno de los focos de contagio más notorios de las primeras semanas de la pandemia. El 12 de marzo, esa comunidad autónoma era una de las más afectadas por la covid de España con 185 casos, la gran mayoría relacionados con un foco en Haro. Allí llegó el virus después de que el 23 y el 24 de febrero casi cien allegados participaron en el velatorio y funeral de un hombre en Vitoria. Enrique Ramalle, director General de Salud Pública, Consumo y Cuidados de La Rioja, explica que no atribuyen el caso de Haro a un supercontagiador. “Allí hubo muchas personas durante dos días, en un espacio cerrado, además en febrero, que hacía frío, y estarían las ventanas cerradas, y en una época en la que aún se desconocía la posibilidad de contagio”, explica Ramalle.“Ahora, en los casos que hemos detectado, y quizá por el confinamiento, hemos visto que el número de contactos estrechos no es muy alto, unos ocho o diez por persona”, señala. “Hasta ahora, el caso con más contactos, tenía 30 y se dieron 4 contagios”, añade. Ramalle afirma que no tienen constancias de casos de supercontagio, pero apunta a que las circunstancias pueden cambiar con el desconfinamiento. Por último, pide tacto con la forma de tratar el tema de Haro.Esta es otra de las preocupaciones del estudio de los focos de elevado contagio y la identificación de supercontagiadores. Un reciente brote en Corea del Sur se relacionó con locales de fiesta gay y los jarreros contagiados pertenecían a familias gitanas de la localidad. La tendencia a estigmatizar a los infectados, como si fuesen responsables de la enfermedad, puede ser nocivo para el control de la enfermedad al llevar a ocultarla hasta que sea demasiado tarde.Salas considera que hay que desterrar la idea de la culpabilidad de los contagiados y que desarrollar un perfil de los supercontagiadores puede aportar una comprensión sobre la pandemia de la que ahora carecemos. “El conocimiento a veces no necesita un objetivo concreto y las soluciones muchas veces llegan cuando sabemos más sobre un problema, del lugar menos esperado”, concluye.Puedes escribirnos a daniel@esmateria.com o seguir a MATERIA en Facebook, Twitter, Instagram o suscribirte aquí a nuestra Newsletter.",El misterio de los ‘supercontagiadores’ del coronavirus,/ciencia/2020-05-23/el-misterio-de-los-supercontagiadores-del-coronavirus.html,elpais,,3,651
a6e02320d12efd0270c8192246a10c13,"Una pareja se toma una foto.Imaginemos una ciudad en la que todo fuera plateado y brillante y reflejara cuanto quedara a su alcance provocando duplicados de las calles, de las fachadas de los edificios, de los autobuses o automóviles, así como de las personas que circulasen por las aceras. Las réplicas especulares resultarían tan perfectas que se confundirían con el mundo real. En ocasiones, al caminar por una avenida verdadera, se metería uno inadvertidamente en una calle falsa de las que, producto de la reflexión permanente, se abrirían a derecha e izquierda. Iríamos y vendríamos del otro lado del espejo todo el tiempo...Inicia sesión para seguir leyendoSólo con tener una cuenta ya puedes leer este artículo, es gratisRegístrateIniciar SesiónGracias por leer EL PAÍS",innegable.html,/opinion/2020-05-21/innegable.html,elpais,,0,60
2da7909771299bc2fa5b17e24346ef41,"La NBA ha entablado negociaciones con Walt Disney Company para reanudar el resto de la temporada en el complejo ESPN Wide World of Sports de Disney en Orlando, Florida, a fines de julio.Las conversaciones cuentan con la participación de la Asociación Nacional de Jugadores de Baloncesto (NBPA) y contempla la reanudación de la temporada que fue suspendida el 11 de marzo en el complejo Disney en Florida. Sería una sede única en la que se disputarían todos los partidos y se llevarían a cabo los entrenamientos. Los jugadores y el personal de la NBA necesario para la celebración de los partidos vivirían en el complejo.“Nuestra prioridad sigue siendo la salud y la seguridad de todos los involucrados, y estamos trabajando con expertos en salud pública y funcionarios gubernamentales en un conjunto integral de pautas para garantizar que existan protocolos y protecciones médicas apropiadas”, explicó Mike Bassa, portavoz de la NBA.La NBA suspendió su temporada indefinidamente el 11 de marzo a causa del positivo por coronavirus de Rudy Gobert, que se conoció en los prolegómenos del partido entre Utah y Oklahoma City, y los efectos de la pandemia. Cuando la competición fue suspendida quedaban por disputarse 259 partidos de los 1.230 previstos en la fase regular, además de los playoffs, que suelen ser más de 80.Tres pabellones y complejo hoteleroNo está claro si la NBA jugará el resto de su temporada regular o si pasará directamente a los playoffs. El complejo deportivo de Disneyworld, de 89 hectáreas, cuenta con tres pabellones y una gran capacidad hotelera y permitiría a la liga reiniciar la competición y limitaría la exposición externa a quienes estén concentrados allí.La NBA tiene programada una reunión de los responsables de las franquicias el próximo viernes en la que se espera que desvele el calendario y los planes necesarios para implementarlo. Los equipos esperan que la liga les permita los entrenamientos en grupo alrededor del 1 de junio.Los planes para la reanudación de la competición incluyen que las plantillas de los equipos cumplan un periodo de dos semanas de cuarentena, una o dos semanas de entrenamientos individuales en las instalaciones del equipo y una fase de entrenamientos en grupo de dos a tres semanas, ya en una misma sede. Muchos propietarios de la NBA, ejecutivos y miembros del sindicato de jugadores (NBPA) creen que el comisionado Adam Silver aprobará el regreso a la competición en junio. El día 8 de mayo los jugadores pudieron empezar a entrenarse de manera individual en aquellas instalaciones que estuvieran abiertas. Los integrantes de varios equipos empezaron a ejercitarse, pero con la prohibición de hacerlo en grupo y con entrenadores.",La NBA negocia para reanudar la Liga a finales de julio en el complejo Disney de Orlando,/deportes/2020-05-23/la-nba-negocia-para-reanudar-la-liga-a-finales-de-julio-en-el-complejo-disney-de-orlando.html,elpais,,9,216
7a8f2b973a215ef2ae56e278bb7b6c37,"El primer día de clase de Lengua y Literatura de bachiller, curso 1958-1959 en el colegio de los Escolapios de Bilbao, el profesor, un cura joven que venía de Roma, donde había sido secretario del padre general de la orden, nos propuso elegir el mejor comienzo de entre una selección de tres o cuatro frases. Recuerdo dos de ellas. La primera era esta: “Desde los tiempos de nuestros primeros padres…”. La segunda decía: “Si el cielo se ganase a fuerza de oraciones, a buen seguro mi tía abuela…”. Este era el comienzo más original, según opinó el profesor, y el menos original, el del paraíso terren...Inicia sesión para seguir leyendoSólo con tener una cuenta ya puedes leer este artículo, es gratisRegístrateIniciar SesiónGracias por leer EL PAÍS",cosas que no olvide.html,https://elpais.com/ideas/2020-05-16/cosas-que-no-olvide.html,elpais,elpais.com,1,65
74513d770210e05a38cab3c987b01296,"Sede de la Reserva  Federal de Estados Unidos, en Washington.OLIVIER DOULIERY / AFPLos indicios de aparición de una vacuna contra la covid-19 se han convertido en el verdadero determinante de las posibilidades de recuperación económica. Por el momento, la crisis más pronunciada y dañina desde la Gran Depresión será el denominador común de la totalidad de las economías avanzadas. La recuperación del consumo de las familias y de la inversión de las empresas seguirá inhibida por la falta de confianza. También en Estados Unidos, que sufre las consecuencias de una lamentable gestión sanitaria. El presidente de la Reserva Federal acaba de admitir que descubierta algún día la vacuna, su desarrollo no tendrá lugar de la noche a la mañana y, en consecuencia, no habrá una completa recuperación económica inmediata. Al igual que las demás economías avanzadas, si no apareciesen rebrotes de la pandemia y si mediasen estímulos fiscales y monetarios suficientes, EE UU podría abandonar el territorio negativo de crecimiento en la segunda mitad del año, pero costará mucho tiempo restablecer completamente los daños.El impacto más explícito y lacerante es el aumento de la tasa de paro. Quizás con mayor trascendencia que en otros países, esos registros que evocan los de los años treinta del siglo pasado determinan gran parte de la acción política. Más aún si en pocas semanas se pasó de una tasa de paro del 3,8% —pleno empleo— a la más elevada desde la II Guerra Mundial, del 14,7%, el pasado abril. Son más de 36 millones de ciudadanos los registrados para obtener el subsidio de desempleo. Por eso no es de extrañar que no solo la Administración republicana, sino también la oposición demócrata, asuma la necesidad de apoyar más aún la actividad económica con la política fiscal. El Congreso ya ha aprobado medidas de estímulo por valor de tres billones de dólares, pero cabe esperar que los dos principales partidos políticos convengan en inyecciones adicionales de recursos públicos. Con independencia de la ideología que cada uno mantenga respecto del papel del Estado en la economía, cuando la tasa de paro excede el umbral del 10%, la clase política y las instituciones, incluido el banco central, dejan a un lado los prejuicios y, como demostraron en la anterior crisis, utilizan con pragmatismo todos los medios a su alcance, también el presupuesto federal, con el fin de neutralizar males peores. Gran contraste con Europa, que con daños superiores tiene permanentes dificultades para concretar los fondos suficientes para facilitar su reconstrucción. Para que los europeos sorteen los riesgos de empobrecimiento, pero también para que el proyecto de integración se mantenga vivo. Es altamente probable que la economía americana, a pesar de una crisis sanitaria peor, consiga una recuperación mejor. ",estimulos en ee uu.html,/opinion/2020-05-19/estimulos-en-ee-uu.html,elpais,,2,225
