uid,body,title,url,newspaper_uid,host,n_tokens_title,n_tokens_body
97c840287bb2526e3a5fc6d8305ac5e7,"Tres personas ataviadas con trajes de protección en La Paz.Christian Lombardi/ZUMA Wire/dpa / Europa PressColapso sanitario. Lo que los bolivianos querían evitar con un confinamiento que ya cumple dos meses se ha producido de todas maneras en una de las regiones más grandes del país: el Departamento de Beni, al noreste. Su gobernador, Fanor Amapo, ha declarado estado de “desastre” y ha solicitado la ayuda nacional e internacional. La situación de la capital, Trinidad, ha despertado el fantasma de otros territorios de Latinoamérica severamente golpeados por la pandemia, como la ciudad ecuatoriana de Guayaquil. Esta emergencia se da mientras el Gobierno interino todavía está noqueado por un escándalo de corrupción en el Ministerio de Salud.La ciudad de Trinidad, capital de Beni, tiene algo más de 100.000 habitantes. Es una de las capitales departamentales más pequeñas de Bolivia. Al mismo tiempo, es la segunda, después de Santa Cruz de la Sierra, con más casos confirmados de la covid-19: 858 hasta este viernes. Pero se teme que esa cifra no llegue “ni a la sombra de lo que realmente está sucediendo”, ha denunciado la prensa local. La dificultad de acceso a las pruebas y la tendencia de los enfermos a quedarse en casa en lugar de presentarse en unos hospitales colapsados y arriesgarse a morir lejos de sus parientes impiden cuantificar con precisión la magnitud del daño que está causando la pandemia en Trinidad.Hay indicios preocupantes. El número oficial de decesos por la covid-19 en Beni es 57, pero en el cementerio reservado para las víctimas de esta enfermedad en la capital ya se han enterrado a más de 100. Además, se reportan varios fallecimientos en domicilios y escasez de ataúdes y de personal para proceder a los entierros. “Hay varios que mueren en sus domicilios. La gente está en sus casas con mates [infusiones], eucaliptos [nebulizadores], pero en dos o tres días el malestar se convierte en neumonía”, explicó Ronald Gutiérrez, director del Centro Centinela de Trinidad al periódico Página Siete, de La Paz.Otra medicina de la que echan mano los habitantes de la región es la ivermectina, una sustancia que sirve para desparasitar, y que se solía usar regularmente en Beni, como en otras regiones ganaderas del país. El Gobierno boliviano la autorizó como remedio experimental para la covid-19, después de conocer algunos estudios realizados en Perú que le atribuían la capacidad de disminuir la carga viral en los enfermos. La gran diferencia de la ivermectina respecto a los otros remedios experimentales que se están usando en diferentes partes del mundo contra el virus es su bajo precio; no obstante, los científicos debaten sobre su eficacia y la dosis que debe administrarse, además de que existen problemas de automedicación “preventiva”.Beni tiene el segundo PIB más pequeño de Bolivia. No cuenta con suficientes hospitales y médicos para enfrentar la crisis. Además, más de 80 doctores y 25 enfermeros se reportaron contagiados. Un grupo de voluntarios llegó de La Paz para reforzar al personal sanitario de la zona. Este grupo encontró que los centros de salud estaban colapsados, faltaban equipos e insumos y los que había no estaban siendo bien usados, lo que explicaba que hubiera tantos casos entre los trabajadores del sector. La principal carencia en Beni, como en el resto del país, es la de respiradores: la decena que se ha instalado ya está ocupada y los pacientes críticos solo reciben la ayuda de bombonas de oxígeno.La compra de más respiradores era una de las principales promesas del Gobierno interino de Jeanine Áñez a los bolivianos. Esta acción recibió un duro golpe hace unos días, pues estalló un grave escándalo de corrupción que llevó a la detención del ministro de Salud, Marcelo Navajas, y de otros funcionarios de este Ministerio. Todos ellos estuvieron involucrados en la compra, a través de intermediarios, de 170 respiradores experimentales de la firma española GPA Innova. Las investigaciones de la Fiscalía desvelan una trama en la que participaron funcionarios y hombres de negocios relacionados con el actual Gobierno y también con el anterior. Hasta ahora ha trascendido que tres intermediarios, una empresa española y dos empresarios bolivianos, inflaron el precio de fábrica de cada respirador, que según confirmó ayer el gerente de GPA Innova, Pau Sarsaneda, a través de Twitter, era de 7.200 dólares. Por esta operación, los aparatos terminaron costando algo menos de 28.000 dólares en el contrato de compra. El valor total del contrato fue de 4,7 millones de dólares, de los cuales se pagaron dos millones con dinero que le había prestado a Bolivia el Banco Interamericano de Desarrollo (BID). Por este motivo, el personal local de esta institución también se encuentra bajo investigación.Luego del escándalo, las organizaciones opositoras al Gobierno han pedido que Áñez renuncie a su aspiración de presentarse a las próximas elecciones presidenciales, que fueron postergadas por la emergencia sanitaria. La presidenta no ha respondido a la oposición. En cambio, prometió que investigará el caso de sobreprecio “caiga quien caiga”, que hará devolver el “dinero robado” y que introducirá mecanismos para que el público supervise la corrección de las compras estatales.Información sobre el coronavirus- Aquí puede seguir la última hora sobre la evolución de la pandemia- Así evoluciona la curva del coronavirus en España y en cada autonomía- Buscador: La desescalada por municipios- Preguntas y respuestas sobre el coronavirus- Guía de actuación ante la enfermedad- Pinche aquí para suscribirse a la newsletter diaria sobre la pandemia",El coronavirus se desboca en una de las regiones más vulnerables de Bolivia ,/internacional/2020-05-22/el-coronavirus-se-desboca-en-una-de-las-regiones-mas-vulnerables-de-bolivia.html,elpais,,5,428
a54dbd0eec36e6b072d03abbc45b1deb,"Venezuela es uno de los países latinoamericanos con menos casos de coronavirus, al menos según las cifras oficiales ofrecidas por el Gobierno de Nicolás Maduro. Menos de mil contagios y 10 fallecidos. Sin embargo, la Academia de Ciencias Físicas, Naturales y Matemáticas lleva semanas advirtiendo en torno al retardo en el desarrollo de la pandemia en el país y planteando la posibilidad de que los casos registren pronto una expansión acelerada en un rango que va de 1.000 a 4.000 infectados al día. En mayo, los contagios se han disparado un 60%, más del 40% durante los últimos seis días.El estudio de la Academia expresa sus reservas en torno a la capacidad del sistema de salud del país para atender una emergencia de estas características, considera la existencia de un amplio registro de casos no detectados y ve improbable que la curva mantenga una tendencia aplanada. Los miembros de la institución fueron señalados por el número dos del chavismo, Diosdado Cabello, en su programa de televisión por fomentar un clima de alarma social. Las amenazas de Cabello no se concretaron, pero a partir de mayo los casos de coronavirus han aumentado de forma considerable.El incremento de esta semana ha conocido un inesperado refuerzo: el penoso retorno de miles de venezolanos que en los últimos años migraron en busca de oportunidades. Se trata de personas que se fueron a Colombia u otros países de la región como Perú y Ecuador y que están regresando por no tener acceso a sus sistemas sanitarios. En muchos casos, vuelven a pie, a través de caminos informales conocidos como trochas, y sin recibir atención médica.Algunos funcionarios han reaccionado con dureza ante el retorno de estos migrantes sin recursos. Lisandro Cabello, secretario de Gobierno del Estado Zulia, fronterizo con Colombia, ha declarado que la persona que sea sorprendida cruzando las fronteras sin pasar por los controles de la Guardia Nacional será arrestada. El propio Maduro ha acusado a su homólogo colombiano, Iván Duque, de orquestar el regreso anarquizado de emigrantes venezolanos para perjudicar al país.Con 944 casos, 262 personas recuperadas y 10 fallecidas, Venezuela tiene en este momento una de las cifras más bajas de contagio por coronavirus de América Latina. El Gobierno se ha atribuido los méritos de esos datos y ha reivindicado sus aciertos en el tratamiento de la pandemia. Personal médico integrado por venezolanos y cubanos desarrolla operaciones de detección en barriadas y urbanizaciones para identificar casos realizando pruebas rápidas. Sin embargo, entre médicos y políticos opositores está muy extendida la convicción de que esa curva tenga que ver con la catástrofe económica por la que atraviesa el país y su aislamiento en el tablero internacional.Rafael Orihuela, miembro del Instituto de Medicina Tropical de la Universidad Central de Venezuela, opina que el país está por ingresar a una fase de la expansión del virus entre los meses de junio y septiembre. “Hay tres hitos en el desarrollo de la pandemia en Venezuela. Los primeros casos importados, aislados, procedentes sobre todo de Europa. Hubo un segundo foco importante en la Isla de Margarita, procedente de la República Dominicana, y ahora podemos identificar un aumento, que ya no es aritmético, sino exponencial, potenciado por el regreso de emigrantes, con proliferación de casos locales, que en esta fase ya es muy alto. El Gobierno se jacta de haber hecho una cantidad alta de pruebas rápidas para identificar casos sospechosos. Eso es cierto, pero es inútil. Las pruebas rápidas están contraindicadas, no son fiables. La prueba que hay que hacer es la de PCR, y ahí vamos a la cola de la región”.Los casos oficiales registrados son, para el epidemiólogo y académico José Felix Oletta, “la punta de un iceberg”. El académico sospecha que hay un subregistro de 40% de casos. Como muchos otros especialistas, Oletta teme que el destruido sistema público de salud venezolano se vea desbordado por las circunstancias. “Hay pocas camas disponibles por habitantes, muchos hospitales sin agua, sin jabón, pocos guantes, tapabocas que se reutilizan, una diáspora masiva de enfermeras y médicos. Además, es notoria la opacidad informativa del gobierno”Oletta opina que es “imposible” predecir cómo será la evolución de la pandemia en los meses que siguen, pero considera un hecho que el país dejó atrás la proliferación moderada de contagios. Orihuela se anima a distinguir dos posibilidades: una explosión masiva e incontrolada de los casos, “o un crecimiento que evolucione sobre una curva de contagios aplanada, abundante pero estable, mitigada por los efectos del calor en los meses que se aproximan”.Información sobre el coronavirus-Aquí puede seguir la última hora sobre la evolución de la pandemia- El mapa del coronavirus: así crecen los casos día a día y país por país- Preguntas y respuestas sobre el coronavirus- Guía de actuación ante la enfermedad- En caso de tener síntomas, estos son los teléfonos que se han habilitado en cada país de América Latina.",Los casos de coronavirus se disparan un 40% en una semana en Venezuela ,/sociedad/2020-05-23/los-casos-de-coronavirus-se-disparan-un-40-en-una-semana-en-venezuela.html,elpais,,5,401
340a875ab794c2c46449eddea12db29a,"Nada está escrito sobre si el estado de alarma concluirá el próximo 7 de junio. El presidente del Gobierno, Pedro Sánchez, se lo plantea así, pero todo dependerá de la evolución de la pandemia. Por si acaso, el Gobierno emprende de nuevo el diálogo con diferentes grupos políticos por si considerase necesario pedir una sexta prórroga. Aunque para la quinta logró los votos, el Ejecutivo albergó dudas hasta última hora y firmó un pacto con EH Bildu que lo sumió en una tormenta política. El presidente descartó este sábado exigir dimisiones por el episodio y defendió la vigencia de la coalición con Unidas Podemos.En su primera comparecencia tras el fiasco del acuerdo con EH Bildu para la derogación de la reforma laboral, Sánchez se afanó en dar la crisis por cerrada y en alejar cualquier especulación sobre una hipotética ruptura de su coalición con Unidas Podemos. “Somos un Gobierno unido, para cuatro años, y tengo la mejor opinión de las personas que lo conforman”, aseguró el presidente, quien también descartó que vaya a depurar responsabilidades en su entorno. Sobre las opiniones divergentes entre la vicepresidenta económica, Nadia Calviño, opuesta a abordar ahora el cambio del marco laboral, y el también vicepresidente y líder de Podemos, Pablo Iglesias, que defendió el acuerdo con los abertzales, Sánchez sostuvo que las posiciones de ambos “son compatibles”.La crisis de esta semana se originó por el terreno peligroso en que entraron las prórrogas del estado de alarma desde que el PP anunciara en la cuarta que no apoyaría ninguna más. El Gobierno sintió vértigo y abrió del todo el abanico del diálogo parlamentario, con la excepción de Vox. Y, pese a lo ocurrido, no lo va a cerrar, sino todo lo contrario. No es seguro que el uso de ese instrumento constitucional concluya el próximo 7 de junio, aunque si Sánchez solicitara la aprobación de una sexta, tendría unas características más limitadas, referidas a la libertad de movimiento y circunscritas a algunas comunidades autónomas, o a parte de alguna de ellas. El presidente lo reconoció en su comparecencia en el palacio de la Moncloa en respuesta a una pregunta directa: “Estamos estudiando una sexta prórroga porque es nuestro deber, aunque habrá que ver cuál es la evolución epidemiológica, pero lo haremos escuchando a los expertos y a las comunidades autónomas”. Para evitar riesgos, el Gobierno volverá a reanudar el diálogo con las fuerzas políticas y los Ejecutivos autonómicos por si se planteasen más medidas restrictivas. De nuevo, nadie se quedará fuera, como la última vez, excepto Vox, que negó cualquier diálogo al respecto, y el PP, que ya solo apuesta por el rechazo a más prórrogas.En el Gobierno aseguran que no volverán a repetir el error del pacto con EH Bildu —luego matizado— para la derogación “íntegra” de la reforma laboral, que le ha costado la ruptura momentánea del diálogo social, críticas internas desde el PSOE y diferencias entre miembros de los dos socios de la coalición. Si decidiese pedir otra prórroga, el Ejecutivo instará a sus interlocutores a que la negociación solo se centre en la gestión de pandemia y no en otros asuntos, según fuentes socialistas. No se hizo así con EH Bildu, ya que socialistas y Unidas Podemos accedieron a un acuerdo sobre una materia ajena a la pandemia y al estado de alarma.Las negociaciones con otros grupos fracasaron porque también pedían contrapartidas diferentes. “El Gobierno no tenía garantizada una mayoría; una vez que el PP se negó a apoyar el estado de alarma, provocó que se abriera la espita para que otros grupos plantearan temas distintos a la salud: compromisos de investidura o de legislatura. Se podría haber evitado si el PP hubiera votado a favor de la prórroga”, sostuvo el presidente, que evitó cualquier autocrítica.Todas las preguntas de este sábado a Sánchez sobre la crisis abierta por el pacto con la izquierda abertzale fueron respondidas de la misma forma: sin entrar en cómo se pudo cerrar un acuerdo sobre una materia tan sensible para corregirlo tres horas después. Eso sí, el reconocimiento de que el Ejecutivo no tenía la seguridad de contar con los apoyos necesarios fue paladino, como ya vienen haciendo desde el jueves distintas fuentes socialistas y del Gobierno. Con ERC no hubo acuerdo al negarse el Ejecutivo a activar de inmediato la mesa de negociación política con la Generalitat. Con los republicanos se intentó sin éxito hasta altas horas de la noche del martes alcanzar un pacto para el pleno del Congreso que comenzaba a las nueve de la mañana siguiente.Con el PNV las cosas fueron bien porque el Ejecutivo aceptó que las comunidades autónomas participen en las decisiones sobre la desescalada. La voluntad de acuerdo con Ciudadanos se vio correspondida por el Gobierno, toda vez que el partido liberal, además, solo enfocaba sus pretensiones en el terreno de la lucha contra el coronavirus. Aun así, los socialistas no las tenían todas consigo y ampliaron la negociación a otros grupos, incluido EH Bildu.Sobre la reforma del marco laboral aprobado por el PP en 2012, Sánchez se comprometió a no tomar ninguna decisión sin consultar a los agentes sociales. Aunque la patronal ha dado por roto el diálogo, el jefe del Ejecutivo confía en retomarlo “cuanto antes”. Para ello, dedicó grandes elogios al presidente de la CEOE, Antonio Garamendi: “Un patriota con el que tengo muy buena relación”.Información sobre el coronavirus- Aquí puede seguir la última hora sobre la evolución de la pandemia- Así evoluciona la curva del coronavirus en España y en cada autonomía- Preguntas y respuestas sobre el coronavirus- Guía de actuación ante la enfermedad- En caso de tener síntomas, estos son los teléfonos que se han habilitado en cada comunidad- Pinche aquí para suscribirse a la newsletter diaria sobre la pandemia",Pedro Sánchez abre nuevas negociaciones ante la posibilidad de una sexta prórroga del estado de alarma,/espana/2020-05-23/pedro-sanchez-abre-nuevas-negociaciones-ante-la-posibilidad-de-una-sexta-prorroga.html,elpais,,9,472
63c2f5fcfdcc2e0f32e6ff975530d626,"La descubrí como hija de Javier Cámara en Vamos Juan, (TNT) una de las series revelación de la cuarentena. Pero resulta que Esty Quesada lleva años siendo una celebridad en Youtube, donde factura unos vídeos con tanto vitriolo como ternura sobre la vida a sus años y circunstancias con el alias Soy una pringada. En la videollamada habla como en pantalla, con una parsimonia que parece de pega hasta que te acostumbras y ves que es la suya propia. Además, se muestra educadísima y genuinamente interesada en la charla, cosa que no siempre pasa con otras luminarias más adultas y prestigiosas. O igual es que ambas nos dejamos de postureo y hablamos de pringada a pringada.¿De qué hablan una señora de más de 50 y una youtuber de 25?Uy, de muchas cosas. De la vida, de nuestros puntos de vista, de novios, de series, de películas, de amor, de odio, de la muerte. Para mí la edad no es barrera, solo que la otra persona sea gilipollas.¿A los 25 se piensa en la muerte?Siempre la he tenido muy presente. Primero porque desde pequeña me he querido matar. Y luego porque se ha muerto mi padre, mis abuelos, mi tío, mucha gente. Con mi padre hablo con la ouija.Perdone, ¿de niña quería matarse? ¿Matarse de suicidarse?Sí, sé que sorprende, creen que lo digo de coña, pero querer matarse no es tan raro. Le pasa a todo el mundo en algún momento.¿Tan horrible era su vida?La vida es un castigo. No te la puedes tomar porque nada tiene sentido. Entonces, o te matas o vives. Y yo en su momento decidí vivir. Vivir no tomándome en serio nada, haciendo lo que me sale de los cojones. Por eso doy tanta importancia a la amistad, son los valores que hacen que la vida sea un poquito menos mierda.¿La salvaron los amigos?En esas épocas tampoco tenía muchos amigos. No sé, fue una cosa muy rara. Sobre todo me ayudaron las pelis, las series, todo eso. Luego, una vez que estuve mejor, pude disfrutar de los amigos. Porque cuando estás mal y te quieres matar, por muy buenos que sean tus amigos, no te van a sacar de ahí, solo te vas a sacar tú.¿Qué le hizo querer vivir?Yo estaba depresiva viva, nivel: venga, hoy me suicido. Y me salvaba la vida una cosa tan estúpida como: hoy no, que sale un nuevo capítulo de mi serie favorita, ya me suicido mañana. La gente con depresión se sentirá identificada. Vas buscando excusas. Al final me harté de mí misma, en plan: chica, ya vale, o te matas o vives. Y dije: vivo. Salí de mi zona de confort y me lancé a hacer cosas que me daban mucho miedo, pero me sacaron de ahí. El clic fue estar hasta los cojones de mí misma.SOY UNA PRINGADABajo ese explícito alias Estíbaliz, Esty, Quesada (Bilbao, 25 años) congrega a una nutrida parroquia con sus descarnadas vídeohistorias en Youtube. Autora de dos libros: 'Freaks' y 'Cosas que me salvaron la vida', creó y dirigió la serie 'Losers' y coprotagoniza la sátira política 'Vamos, Juan', con Javier Cámara, y 'Road trip', un viaje por Estados Unidos junto a Nuria Roca. Su vitriolo, sus pintas y su maquillaje esconden una capacidad de observación del prójimo que ya quisieran muchos analistas de traje y corbata.Creo que odia a Mr. Wonderful y los libros de autoayuda.Es que no sirven para nada. ¿Tú te crees que a mí cuando estaba en depresión me iba a salvar la vida un texto de: 'sonríe, la vida es corta'? Se habla mucho de la felicidad sin hablar de la tristeza, y son cosas que van de la mano. .¿La tristeza ahuyenta a los otros?La tristeza es fracaso. Cuando tenía depresión muchos me decían: eres una vaga, no haces nada. Y yo: a lo mejor no hago nada porque estoy cada minuto pensando en cortarme las venas. La tristeza no gusta porque equivale a fracaso, y el fracaso en esta sociedad es una persona no productiva que no contribuye al capitalismo.¿Y si encima de triste se está gordo?Ser gorda y estar triste es el último o uno de los últimos eslabones de la cadena social. No eres productiva, y no eres el objetivo del consumo. Te sales de toda norma. Eres una putada para la sociedad, te lo hacen pagar rechazándote y el rechazo siempre produce dolor.Actriz, youtuber, guionista. ¿A qué pongo que se dedica?No sé, persona que hace cosas a veces. También puedes poner artista, porque he actuado, he escrito, he dirigido, pero vamos, que tampoco me considero yo artista.Pues dicen sus colegas de rodaje que es superprofesional.Uy, gracias. He sido muy pobre, valoro mucho el trabajo y como no lo quiero perder soy profesional y valoro el esfuerzo de los demás. Quienes no hemos llegado a fin de mes, hemos tenido una infancia pobre y sabemos lo que valen las cosas, trabajamos de otra forma. Conozco a gente que se lo han dado todo y el día que se tiene que ganar el pan, no sabe.¿Qué es lo mejor que tiene?Uf, pues no sé. Soy muy materialista y tener un iPhone me ha cambiado la vida, pero lo mejor que tengo y tendré son los amigos. Son mucho más importantes que la familia y que los novios y las novias y que todo. Y luego, a nivel de atributo, pues que me río de todo. A veces me supone un poco de tortura porque incluso cuando quiero hablar seriamente de algo mío, no puedo y en seguida lo tengo que llevar a la burla.Igual es que el autoataque es su mejor defensa.La seriedad es que me asusta mucho. Esto típico del 'tenemos que hablar'. Me cago viva, aunque no sea nada. Entonces siempre lo llevo a la broma, pero también creo que es una de mis mejores cualidades porque tengo un humor muy negro y muy fuerte. Antes tenía mucho miedo a que me hiciesen daño, pero es parte de la vida y si te lo hacen, pues una lección que aprendes y una hostia que te ayudará a seguir con tu vida. Ya no lo temo como antes.“Ni hombre ni mujer ni hetero ni homo”. He visto que se define como “una gorda que insulta”.Eso lo seré hasta que la palme, pero es que yo de género no me siento ni hombre ni mujer, estoy como en el medio, pero no es una cuestión a la que le dé la más mínima importancia. Soy así y ya está. Que parece que ahora, por ser de género no binario te tienen que dar una pensión de mil euros del Gobierno. Y no, guapa. Es que ¿ves? El activismo fake me pone muy nerviosa porque yo soy de genero no binario pero no lo tengo que ir diciendo y usándolo de excusa para todo . Y de sexualidad, pues bisexual, pero tampoco lo uso como excusa.¿Qué tal el confinamiento?Bien, a ver, estoy ya harta porque quiero disfrutar de la puta vida y salir de fiesta y emborracharme, yo qué sé, estar tirada en una pista de baile y vomitarme encima Pero bien, la gente que ha llevado mal el primer mes es porque no se soporta a sí misma y no tiene mundo interior.Dijo en la tele: “ahora soy casi feliz, ya me jode”. ¿Nunca está contenta?A ver, es que la felicidad es una cosa muy corta que se siente muy pocas veces, pero también se podría llamar a estar en paz contigo misma, que muy poca gente lo está y yo puedo decir a día de hoy que lo estoy a pesar de mis traumas y mis movidas. La felicidad la concibo como disfrutar de lo que tienes y estar dispuesta a arriesgarte. No soy feliz porque no creo que nadie lo sea plenamente, pero digamos que estoy contenta.",Esty Quesada: “Ser gorda y estar triste es el último eslabón de la cadena social”,/television/2020-05-23/esty-quesada-ser-gorda-y-estar-triste-es-el-ultimo-eslabon-de-la-cadena-social.html,elpais,,9,547
